{
  "$schema": "https://json-schema.org/draft/2020-12/schema",
  "$id": "https://cloverleaf.example/schemas/rfc.schema.json",
  "title": "RFC",
  "description": "A Cloverleaf Discovery proposal.",
  "type": "object",
  "required": ["id", "type", "status", "owner", "project", "title", "problem", "solution", "unknowns", "acceptance_criteria", "out_of_scope"],
  "properties": {
    "id": { "$ref": "https://cloverleaf.example/schemas/work-item.schema.json#/$defs/workItemId" },
    "type": { "const": "rfc" },
    "status": {
      "type": "string",
      "enum": ["drafting", "spike-in-flight", "planning", "gate-pending", "approved", "completed", "rejected", "abandoned"]
    },
    "owner": { "$ref": "https://cloverleaf.example/schemas/work-item.schema.json#/$defs/owner" },
    "project": { "type": "string", "minLength": 1 },
    "parent": { "$ref": "https://cloverleaf.example/schemas/work-item.schema.json#/$defs/workItemRefOrNull" },
    "relationships": {
      "type": "array",
      "uniqueItems": true,
      "items": {
        "type": "object",
        "required": ["type", "target"],
        "properties": {
          "type": { "$ref": "https://cloverleaf.example/schemas/work-item.schema.json#/$defs/relationshipType" },
          "target": { "$ref": "https://cloverleaf.example/schemas/work-item.schema.json#/$defs/workItemRef" }
        },
        "additionalProperties": false
      }
    },
    "title": { "type": "string", "minLength": 1 },
    "problem": { "type": "string", "minLength": 1 },
    "solution": { "type": "string", "minLength": 1 },
    "unknowns": {
      "type": "array",
      "items": { "type": "string", "minLength": 1 },
      "description": "Each unknown is a candidate Spike."
    },
    "acceptance_criteria": {
      "type": "array",
      "items": { "type": "string", "minLength": 1 },
      "minItems": 1
    },
    "out_of_scope": {
      "type": "array",
      "items": { "type": "string", "minLength": 1 }
    },
    "extensions": { "$ref": "https://cloverleaf.example/schemas/extensions.schema.json" }
  },
  "additionalProperties": false
}
